标题,链接
文化企业社会责任报告发布平台,http://ent.people.com.cn/GB/436846/441076/index.html
“人民消费”中消协教育基地,http://finance.people.com.cn/GB/8215/452688/index.html
习近平主持首届中国―中亚峰会并发表主旨讲话,http://politics.people.com.cn/n1/2023/0520/c1024-32690594.html
携手建设中国―中亚命运共同体,"	
http://opinion.people.com.cn/n1/2023/0520/c1003-32690601.html"
携手开创中国―中亚美好未来,"	
http://opinion.people.com.cn/n1/2023/0520/c1003-32690677.html"
"续写千年友谊  开辟崭新未来
","	
http://world.people.com.cn/n1/2023/0520/c1002-32690600.html"
习近平主持首届中国―中亚峰会并发表主旨讲话,http://pic.people.com.cn/n1/2023/0519/c426981-32690540.html
习近平同中亚五国元首共同会见记者,http://pic.people.com.cn/n1/2023/0519/c426981-32690539.html
习近平和彭丽媛为出席峰会的中亚国家元首夫妇举行欢迎仪式和宴会,http://politics.people.com.cn/n1/2023/0519/c1024-32689678.html
习近平同乌兹别克斯坦总统米尔济约耶夫会谈,http://pic.people.com.cn/n1/2023/0518/c426981-32689641.html
习近平会见土库曼斯坦总统别尔德穆哈梅多夫,http://pic.people.com.cn/n1/2023/0518/c426981-32689638.html
习近平同塔吉克斯坦总统拉赫蒙会谈,http://pic.people.com.cn/n1/2023/0518/c426981-32689541.html
习近平同吉尔吉斯斯坦总统扎帕罗夫会谈,http://pic.people.com.cn/n1/2023/0518/c426981-32689459.html
习近平同哈萨克斯坦总统托卡耶夫会谈,http://pic.people.com.cn/n1/2023/0517/c426981-32688740.html
收到习主席回信 中亚五国青年这样说,http://world.people.com.cn/n1/2023/0518/c1002-32689645.html
欢迎宴会上这道来自中亚的美食 嘹咋咧!,http://politics.people.com.cn/n1/2023/0519/c1001-32690476.html
唐装、唐妆，盛唐风貌是这样被还原的,http://politics.people.com.cn/n1/2023/0519/c1001-32690477.html
习近平同中亚五国元首共同会见记者,http://politics.people.com.cn/n1/2023/0520/c1024-32690595.html
宣布正式成立中国―中亚元首会晤机制,http://politics.people.com.cn/n1/2023/0519/c1024-32690304.html
"携手!""一带一路""将中国―中亚关系带入一个崭新时代",http://politics.people.com.cn/n1/2023/0519/c1001-32690520.html
中亚五国元首支持构建更加紧密的中国―中亚命运共同体,"	
http://politics.people.com.cn/n1/2023/0520/c1001-32690629.html"
彭丽媛同出席中国―中亚峰会外方领导人夫人参观西安易俗社,"	
http://politics.people.com.cn/n1/2023/0520/c1001-32690603.html"
搭建新平台 开辟新前景――多国人士积极评价中国―中亚峰会取得丰硕成果,http://world.people.com.cn/n1/2023/0519/c1002-32690549.html
长安复携手 丝路启新程――国务委员兼外长秦刚就中国―中亚峰会成果接受媒体采访,http://world.people.com.cn/n1/2023/0520/c1002-32690599.html
织密经贸往来 共谋繁荣发展――中国―中亚国家经贸合作开启新篇章,http://world.people.com.cn/n1/2023/0520/c1002-32690630.html
习近平向第32届阿拉伯国家联盟首脑理事会会议致贺信,http://politics.people.com.cn/n1/2023/0520/c1024-32690602.html
习近平：阿盟长期致力推动阿拉伯世界联合自强，促进中东地区和平、稳定与发展,http://politics.people.com.cn/n1/2023/0520/c1024-32690602.html
中阿传统友好情谊跨越千年、历久弥坚,http://politics.people.com.cn/n1/2023/0520/c1024-32690602.html
甘肃兰州：河口古镇“黄河灯展”亮灯,http://pic.people.com.cn/n1/2023/0519/c1016-32690578.html
江苏南通：打造世界级船舶海工先进制造业集群,http://pic.people.com.cn/n1/2023/0519/c1016-32690579.html
广西贵港：初夏时节 稻田风景如画,http://gx.people.com.cn/n2/2023/0519/c179464-40422193.html
以雄安新区为窗 透视央企绿色发展新路径,http://finance.people.com.cn/n1/2023/0519/c1004-32690383.html
新疆托克逊：万亩杏园采摘收购忙,http://xj.people.com.cn/n2/2023/0519/c186332-40423316.html
"这些年,习近平主席种下这些友谊之树",http://politics.people.com.cn/n1/2023/0519/c1001-32690558.html
李强主持召开国务院常务会议,http://politics.people.com.cn/n1/2023/0520/c1024-32690610.html
纪念中国伊斯兰教协会成立70周年座谈会举行,http://politics.people.com.cn/n1/2023/0520/c1024-32690612.html
李希:为纪检监察工作高质量发展注入强大动力,http://politics.people.com.cn/n1/2023/0520/c1024-32690613.html
"雄安新区容东片区的""安居""和""乐业""",http://www.rmxiongan.com/n2/2023/0519/c383557-40422875.html
辽宁推动主题教育扎实开展 凝聚振兴力量,http://ztjy.people.cn/n1/2023/0520/c457340-32690632.html
出口超日本 中国汽车工业换道领先,http://finance.people.com.cn/n1/2023/0520/c1004-32690634.html
数读中国|五年来我国医保事业实现历史性跨越,http://health.people.com.cn/n1/2023/0519/c14739-32690069.html
"贵州:万桥越万山 ""黔""路不再难",http://society.people.com.cn/n1/2023/0520/c1008-32690625.html
学习宣传贯彻党的二十大精神,http://cpc.people.com.cn/GB/67481/448544/index.html
刘国中出席2023脱贫地区农副产品产销对接会开幕式,http://politics.people.com.cn/n1/2023/0520/c1001-32690606.html
李鸿忠:为全面建设社会主义现代化国家提供有力法治保障,http://politics.people.com.cn/n1/2023/0520/c1001-32690607.html
何立峰出席中国―中亚实业家委员会成立大会并讲话,http://politics.people.com.cn/n1/2023/0520/c1001-32690608.html
陈文清:全面贯彻落实习近平法治思想提升法学理论研究能力和水平,http://politics.people.com.cn/n1/2023/0520/c1001-32690609.html
秦刚出席哈萨克斯坦驻西安总领事馆开馆仪式,http://world.people.com.cn/n1/2023/0520/c1002-32690605.html
荷兰副首相兼外交大臣将访华,http://world.people.com.cn/n1/2023/0520/c1002-32690618.html
最高法:多举措打击被执行人通过假离婚等方式提前转移财产等失信行为,http://society.people.com.cn/n1/2023/0519/c1008-32690467.html
两部电力领域管理办法迎来修订,http://finance.people.com.cn/n1/2023/0519/c1004-32690544.html
教育部:有条件的地方要将法治实践教育纳入中小学课后服务范围,http://edu.people.com.cn/n1/2023/0519/c1006-32690529.html
公安机关全面实行办案质量终身负责和错案责任倒查制度,http://society.people.com.cn/n1/2023/0519/c1008-32690574.html
一季度末我国商业银行不良贷款率降至1.62%,http://finance.people.com.cn/n1/2023/0519/c1004-32690576.html
"国台办:""尽台湾之物力,讨外国之欢心""可耻行径注定失败",http://tw.people.com.cn/n1/2023/0519/c14657-32690575.html
国家铁路局:铁路运输企业应配备无障碍设施以及助残设备,http://society.people.com.cn/n1/2023/0520/c1008-32690593.html
"2023年""中国旅游日""主会场活动在云南腾冲举行",http://ent.people.com.cn/n1/2023/0520/c1012-32690614.html
第六届中国文联知名老艺术家艺术成就展举办,http://ent.people.com.cn/n1/2023/0520/c1012-32690623.html
这一次，“美债炸弹”会爆吗？,http://world.people.com.cn/n1/2023/0520/c1002-32690586.html
“可疑”的数据，“失信”的东电,http://world.people.com.cn/n1/2023/0520/c1002-32690587.html
中国式现代化的文化底蕴和精神特质,http://theory.people.com.cn/n1/2023/0519/c40531-32689783.html
引领人类政治文明发展进程的中国式民主,http://theory.people.com.cn/n1/2023/0519/c40531-32689826.html
中央苏区时期党的反腐败斗争,http://fanfu.people.com.cn/n1/2023/0519/c64371-32689757.html
正风肃纪反腐在身边|蹊跷的外包服务,http://fanfu.people.com.cn/n1/2023/0519/c64371-32689758.html
正向激励不能只“攥攥拳头喊加油”,http://renshi.people.com.cn/n1/2023/0519/c139617-32689842.html
毛泽东与臧克家：诗词世界心相印,http://cpc.people.com.cn/n1/2023/0519/c443712-32689810.html
战斗在党的革命宣传战线的张仲实,http://cpc.people.com.cn/n1/2023/0519/c443712-32689943.html
居民燃气长期不通 河南固始：协商施工保供气,http://henan.people.com.cn/n2/2023/0518/c351638-40420455.html
河南固始县群众留言反映，由于该县棚改项目中的燃气公司施工进度缓慢，燃气不通，导致300余户居民日常生活受到影响。收到留言后，当地组织相关单位进行协商，完善户内工序，让居民们用上燃气。网友表示满意。,http://henan.people.com.cn/n2/2023/0518/c351638-40420455.html
辽宁阜新：让铁道口的喇叭不再高声扰民,"	
http://leaders.people.com.cn/n1/2023/0519/c58278-32689894.html"
地铁站卫生间挂钩位置偏高？四川成都：进行排查，陆续完成调整,http://liuyan.people.com.cn/threads/content?tid=17868162
天津：将积极推动生态城涉海旅游产品的开发,http://liuyan.people.com.cn/threads/content?tid=17840092
利用人工智能助力解决敬老、养老服务问题,http://liuyan.people.com.cn/threads/content?tid=18031157
黑龙江鹤岗：正在争取启动鹤伊客专项目预可研,http://liuyan.people.com.cn/threads/content?tid=17949250
老旧小区怎么改造？人民日报人民网邀您聊聊,http://leaders.people.com.cn/n1/2023/0517/c58278-32688339.html
人民日报读者来信版关注防灾减灾：筑牢底线思维 增强防灾意识,http://leaders.people.com.cn/n1/2023/0515/c58278-32685883.html
人民日报读者来信版、人民网“人民投诉”征集观演购票体验问题,http://health.people.com.cn/n1/2023/0515/c14739-32685874.html
正在进行！2023创新社会治理典型案例征集活动,http://leaders.people.com.cn/n1/2023/0418/c58278-32667370.html
探访中国―中亚峰会新闻中心,https://mr.people.cn/davmu/share/mp/video/2023/05/4Kgwbh0wzZ/index.html
60秒看蝶中皇后羽化全过程,https://mr.people.cn/davmu/share/mp/video/2023/05/RE200i8nKg/index.html
三地试点优化跨国公司本外币跨境资金集中运营管理,http://finance.people.com.cn/n1/2023/0520/c1004-32690636.html
为加快构建新发展格局，增强国内国际两个市场两种资源联动效应，中国人民银行、国家外汇管理局近日决定在北京、广东、深圳开展试点，优化升级跨国公司本外币跨境资金集中运营管理政策。中国人民银行和国家外汇管理局表示，将持续深化外汇领域改革开放，进一步提升跨境贸易和投融资便利化水平，不断优化跨国公司跨境资金集中运营管理相关政策，更好服务实体经济高质量发展。,http://finance.people.com.cn/n1/2023/0520/c1004-32690636.html
增容改造添动力，清洁能源产业“加速跑”,http://finance.people.com.cn/n1/2023/0519/c1004-32689971.html
年内ETF持续净流入 总规模创新高达1.69万亿,http://finance.people.com.cn/n1/2023/0519/c1004-32689925.html
多家银行下调存款利率 幅度与节奏各有不同,http://finance.people.com.cn/n1/2023/0519/c1004-32690013.html
金融支持新能源汽车下乡需重视风险管理,http://finance.people.com.cn/n1/2023/0519/c1004-32690017.html
国家能源集团研讨数字化生态安全体系建设,http://finance.people.com.cn/n1/2023/0519/c1004-32689989.html
百倍提效，火箭回收从“找”变“等”,http://finance.people.com.cn/n1/2023/0519/c1004-32689818.html
5月17日，长征三号乙运载火箭在西昌卫星发射中心点火升空，成功将北斗卫星导航系统第56颗卫星送入预定轨道。任务中，中国电科网络通信研究院导航国家重点实验室研制的“箭载导航与位置报告装备”，克服复杂环境影响，成功实现火箭分离体实时定位与位置稳定回传，精确“跟踪”并“指引”落点，助力火箭分离体快速回收。,http://finance.people.com.cn/n1/2023/0519/c1004-32689818.html
"""硬核""智能科技成果现身第七届世界智能大会",http://finance.people.com.cn/n1/2023/0519/c1004-32689992.html
4.6亿年前的“海绵宝宝”重见天日,http://finance.people.com.cn/n1/2023/0519/c1004-32689973.html
空、天、地协同，为农场黑土地做“体检”,http://finance.people.com.cn/n1/2023/0519/c1004-32689968.html
无菌蛋并非无菌，你还敢“生吃”吗？,http://kpzg.people.com.cn/n1/2023/0519/c404214-32689780.html
主食全谷化意义重大，专家教你怎么吃够全谷物,http://kpzg.people.com.cn/n1/2023/0519/c404214-32689797.html
对话企业家・百家企业谈信心,http://finance.people.com.cn/GB/441919/448925/index.html
给大地“做B超” 用声波找油气,http://kpzg.people.com.cn/n1/2023/0519/c404214-32689778.html
内蒙古华北东北将有大风沙尘 北方部分地区有强对流,http://society.people.com.cn/n1/2023/0519/c1008-32689948.html
5月19日至20日，受冷空气影响，新疆东部和南部、西北地区东部、内蒙古、东北地区、华北等地将有一次大风降温和沙尘天气。北方部分地区有强对流，预计5月19日08时至20日08时，内蒙古东部、吉林西部、辽宁西部和南部、河北南部和东北部、北京东南部、天津、山东北部、渤海湾等地的局地将有雷暴大风或冰雹天气。,http://society.people.com.cn/n1/2023/0519/c1008-32689948.html
第二批新时代婚育文化建设试点项目将开展,http://society.people.com.cn/n1/2023/0519/c1008-32689879.html
北京丰台实施“点靓凉水河”行动,http://society.people.com.cn/n1/2023/0519/c1008-32689979.html
广西横州推进一二三产业融合,http://society.people.com.cn/n1/2023/0519/c1008-32689846.html
一场崇法尚德的精神文明盛宴,http://society.people.com.cn/n1/2023/0519/c1008-32689966.html
粤桂三家法院协作开展贺江流域环境资源司法保护,http://society.people.com.cn/n1/2023/0519/c1008-32689969.html
京津冀新添高教科创园，听听这里的创业故事,http://edu.people.com.cn/n1/2023/0519/c1053-32690521.html
日前，天津天开高教科创园正式开园。这座充满科技感、未来感的科创园区将被打造成另一处京津冀“创新高地”，未来将成为天津科技创新策源地、科研成果孵化器和科技服务资源集聚区。在这里，一批拥抱梦想的科研人员，开始绘就属于他们的故事。,http://edu.people.com.cn/n1/2023/0519/c1053-32690521.html
河北滦南：多彩社团 缤纷校园,http://edu.people.com.cn/n1/2023/0519/c1053-32690524.html
北京高校教师教学发展工作推进会召开,http://edu.people.com.cn/n1/2023/0519/c1006-32690500.html
中国语言资源保护工程2023年度工作会议召开,http://edu.people.com.cn/n1/2023/0519/c1053-32690518.html
首场中国自主的知识体系成果发布会在人大举办,http://edu.people.com.cn/n1/2023/0519/c1006-32690478.html
第三批“全国高校黄大年式教师团队”创建活动启动,http://edu.people.com.cn/n1/2023/0519/c1053-32690519.html
日本央行近日公布的初步统计结果显示，今年4月日本企业物价指数同比上涨5.8%至119.8。当月对企业物价上涨推动作用最大的是电力、燃气和自来水价格，以及矿产品价格。其中，电力、燃气和自来水价格指数同比上涨25.8%，矿产品价格指数同比上涨23.4%。分析人士认为，日本国内物价加速上升，给日本民众生活带来沉重负担。,http://world.people.com.cn/n1/2023/0519/c1002-32689741.html
第六届进博会在卢旺达举办推介会,http://world.people.com.cn/n1/2023/0519/c1002-32689745.html
意大利北部暴雨造成至少13人死亡,http://world.people.com.cn/n1/2023/0519/c1002-32689848.html
雅万高铁全线接触网一次送电成功,http://world.people.com.cn/n1/2023/0519/c1002-32689904.html
美议员宣布计划弹劾拜登 白宫:无耻的政治噱头,http://world.people.com.cn/n1/2023/0519/c1002-32689893.html
日美首脑会谈遭日本民众连日抗议,http://world.people.com.cn/n1/2023/0519/c1002-32689740.html
日本首相岸田文雄与美国总统拜登18日在日本广岛举行会谈。近百名日本民众17日和18日举行集会和示威游行，抗议日美首脑会谈和即将在广岛召开的七国集团（G7）峰会。活动组织者、“8・6广岛大行动实行委员会”事务局长宫原亮说，日本谋求拥有“对敌基地攻击能力”以及增加防务费，这是日本政府配合美国进行的军事恐吓行为。,http://world.people.com.cn/n1/2023/0519/c1002-32689740.html
美媒：美国药品短缺接近历史最高水平,http://world.people.com.cn/n1/2023/0519/c1002-32689905.html
国际博物馆协会聚焦可持续发展与美好生活,http://world.people.com.cn/n1/2023/0519/c1002-32689907.html
喀麦隆近期霍乱疫情致17人死亡,http://world.people.com.cn/n1/2023/0519/c1002-32689909.html
中国――东盟文化交流活动在泰国曼谷举行,http://world.people.com.cn/n1/2023/0519/c1002-32689915.html
“茶和天下・雅集”系列活动在蒙古国举办,http://world.people.com.cn/n1/2023/0519/c1002-32689947.html
多地国防动员办公室多措并举提升群众防灾意识,http://military.people.com.cn/n1/2023/0519/c1011-32690149.html
5月12日是第15个全国防灾减灾日，5月6日至12日为防灾减灾宣传周，主题是“防范灾害风险 护航高质量发展”。多地国防动员办公室主动开展、积极参与防灾减灾相关活动，促进了广大群众防灾意识和战备观念进一步提升。“战争灾害的破坏性与自然灾害有一定的相似性。只有平时注重宣传教育和技能培训，战时才能筑牢防灾减灾救灾的人民防线。”石家庄市国动办工作人员李伟如是说。,http://military.people.com.cn/n1/2023/0519/c1011-32690149.html
北京市举办全民国防教育暨“军营开放日”活动,http://military.people.com.cn/n1/2023/0519/c1011-32690133.html
上海警备区突出军地协作推进主题教育走深走实,http://military.people.com.cn/n1/2023/0519/c1011-32690128.html
甘肃省武威市军地组织抗震救灾演练,http://military.people.com.cn/n1/2023/0519/c1011-32690135.html
日本展开“全球南方”外交攻势,http://military.people.com.cn/n1/2023/0519/c1011-32690144.html
强观察｜各地一季度财政“账本”公布，专家解读,/n1/2023/0519/c32306-32690353.html
近日，各地陆续公布了今年一季度财政收支“账本”。数据显示，绝大多数省份实现收入正增长。其中，河南、宁夏等收入增速超10％，四川、甘肃超9%。各地支出普遍保持较高强度，四川、湖北、甘肃等地支出增速甚至超过15%。“增收”从何而来？各地在哪些领域支出多？收与支之间运行态势如何？人民网“强观察”栏目进行了采访。,/n1/2023/0519/c32306-32690353.html
各地一季度财政“账本”公布，专家解读,/n1/2023/0519/c32306-32690353.html
第三轮输配电价改革，带来哪些影响？,/n1/2023/0519/c32306-32690253.html
又“阳”了怎么办？专家回应,/n1/2023/0519/c32306-32690332.html
他“穿越”时空将古籍重新唤醒,http://fangtan.people.com.cn/n1/2023/0518/c441632-32689254.html
假如博物馆开了间“动物园”……,/n1/2023/0518/c32306-32689488.html
"曹臻
“拉索”首席科学家、中科院高能物理研究所研究员
“拉索”的建成运行，使之成为目前国际粒子天体物理三大实验设施之一，对促进该领域实现重大原创突破。",http://www.people.com.cn/n1/2023/0518/c32306-32689416.html
"车静
中国科学院昆明动物研究所研究员
由于她在两栖爬行动物多样性及保护基础研究方面的突出贡献，获得了第十八届“中国青年女科学家奖”。",http://www.people.com.cn/n1/2023/0517/c32306-32688407.html
"孙逢春
中国工程院院士、北京理工大学机械与车辆学院教授
交叉融合创新是一项系统工程，需要以解决战略领域重大需求为牵引，对产业创新能力提升进行系统部署。",http://www.people.com.cn/n1/2023/0511/c32306-32683645.html
江西：农业有干头、农村有看头、农民有奔头,http://jx.people.com.cn/n2/2023/0519/c190181-40422013.html
"脱贫攻坚取得胜利后，“三农”工作重心转向全面推进乡村振兴。江西省各地全力推动脱贫攻坚和乡村振兴有机衔接。在守牢返贫底线、实现有效衔接、促进经济发展、彰显江西特色“四篇文章”共同作用下，全省脱贫地区的收入差距、发展差距正在逐步缩小。2022年，全省140.9万名脱贫劳动力实现就业，脱贫人口人均纯收入达16348元，增长13.6%。
",http://jx.people.com.cn/n2/2023/0519/c190181-40422013.html
黑龙江省700余公里国省干线将升级,http://hlj.people.com.cn/n2/2023/0519/c220005-40422159.html
江苏出台机关食堂餐饮节约管理地方标准,http://js.people.com.cn/n2/2023/0519/c360303-40422153.html
安徽：制度创新 打造营商环境“强磁场”,http://ah.people.com.cn/n2/2023/0519/c358428-40421840.html
海南：基层一线听民意 精准调研解难题,http://hi.people.com.cn/n2/2023/0519/c231190-40422084.html
四川20条措施支持4市 打造产业发展新高地,http://sc.people.com.cn/n2/2023/0519/c345509-40421960.html
5月15日，“@贵州企业 请您来说发展过程中的堵点痛点难题”征集正式启动，将持续3个月。,http://gz.people.com.cn/GB/195053/406877/407783/index.html
人民网依托“领导留言板”启动“新征程上如何进一步走好网上群众路线”征文活动，面向全社会公开征稿。,http://leaders.people.com.cn/n1/2023/0216/c58278-32624942.html
以文塑旅、以旅彰文 文旅融合带动旅游消费升级,http://ent.people.com.cn/n1/2023/0519/c1012-32689889.html
今天，我们迎来了以“美好中国，幸福旅程”为主题的第13个“中国旅游日”。随着文化和旅游加速融合、市场不断发展，我国文旅消费需求呈现明显升级趋势，文旅融合正焕发“新活力”。在刚刚过去的“五一”假期，全国多家旅游景区游客接待量迎来高峰，文旅消费交出亮丽成绩单，文化和旅游融合特征更加明显。,http://ent.people.com.cn/n1/2023/0519/c1012-32689889.html
美在东方|打卡中国 见证山河壮美风光旖旎,http://ent.people.com.cn/n1/2023/0519/c1012-32689776.html
新活力新气象，中国旅游市场加速回暖,http://ent.people.com.cn/n1/2023/0519/c1012-32689811.html
旅游合作助力构建中国―中亚命运共同体,http://ent.people.com.cn/n1/2023/0519/c1012-32689805.html
《水经注》：百川千流念家国,http://ent.people.com.cn/n1/2023/0519/c1012-32689802.html
外国人汉语大会――配音秀圆满收官,http://ent.people.com.cn/n1/2023/0519/c1012-32689803.html
世乒赛前瞻：乒坛群雄逐鹿德班,http://ent.people.com.cn/n1/2023/0519/c1012-32689790.html
国乒单打名单囊括了当今世界乒坛最优秀的运动员，也是去年包揽成都世乒赛团体赛两项冠军的阵容。樊振东长期占据男单世界第一，马龙世界大赛经验丰富，王楚钦近两年上升迅速；女队方面，孙颖莎牢牢把住世界第一，奥运冠军陈梦和世乒赛卫冕冠军王曼昱状态回暖，王艺迪和陈幸同在近两年大赛中也有亮眼发挥。,http://ent.people.com.cn/n1/2023/0519/c1012-32689790.html
霹雳舞奥运积分赛：刘清漪、商小宇晋级16强,http://ent.people.com.cn/n1/2023/0519/c1012-32689800.html
宁夏将于7月举办全区首届残特奥运动会,http://ent.people.com.cn/n1/2023/0519/c1012-32689784.html
伤病、压力催人成长――专访辽宁队球员张镇麟,http://ent.people.com.cn/n1/2023/0519/c1012-32689793.html
巴黎奥预赛女足第二阶段抽签揭晓,http://ent.people.com.cn/n1/2023/0519/c1012-32689798.html
国际奥委会和国际单项体育组织抵制操控比赛行为,http://ent.people.com.cn/n1/2023/0519/c1012-32689786.html
“博物馆之夜”活动扮靓福州古城,http://ent.people.com.cn/n1/2023/0519/c1012-32689823.html
全国优秀杂技剧目晋京展演在京举办,http://ent.people.com.cn/n1/2023/0519/c1012-32689830.html
大脑被誉为宇宙间最复杂的物体，是思想、情感、感知、行为、学习和记忆的源泉。作为自然科学塔顶的明珠，脑科学也因此成为一门极富魅力的学科――在高科技领域，脑科学是当前火热的人工智能、脑机接口、类脑计算背后的知识基础；在文学创作领域，脑科学是小说、电影中意识上传、共享大脑、记忆互通的现实写照；在生命健康领域，脑科学正不断破解着被称为“生命禁区”的大脑谜团。,http://health.people.com.cn/n1/2023/0520/c14739-32690676.html
“人民消费”中消协教育基地,http://finance.people.com.cn/GB/8215/452688/index.html
陪诊师：做患者的“临时家人”,http://health.people.com.cn/n1/2023/0520/c14739-32690692.html
嗓子哑了难道都是上火闹的？,http://health.people.com.cn/n1/2023/0520/c14739-32690699.html
来点刺激找回失踪的味觉嗅觉,http://health.people.com.cn/n1/2023/0520/c14739-32690700.html
保健品市场要“年轻”更应“常青”,http://health.people.com.cn/n1/2023/0520/c14739-32690693.html
亲喂还是瓶喂？竟然差距这么大！,http://health.people.com.cn/n1/2023/0520/c14739-32690701.html
人民日报社2023年度公开招聘工作人员公告,http://hr.peopledaily.com.cn/Recruitment/notice/view.html?noticeId=229&g=1
人民日报社社会责任报告（2021年度）,http://gongyi.people.com.cn/n1/2022/0531/c151132-32435313.html
学习贯彻习近平新时代中国特色社会主义思想主题教育官网正式上线,http://ztjy.people.cn/n1/2023/0422/c457340-32670511.html
“跟着总书记学党史数据库”正式上线,http://cpc.people.com.cn/n1/2022/0720/c64387-32480412.html
jubao@people.cn,mailto:jubao@people.cn
